{
  "schema_version": 1,
  "event_id": "99999999-2222-4222-8222-222222222222",
  "workout_id": "aaaaaaaa-aaaa-4aaa-8aaa-aaaaaaaaaaaa",
  "session_id": "bbbbbbbb-bbbb-4bbb-8bbb-bbbbbbbbbbbb",
  "origin_device_id": "watch-installation-a",
  "sequence": 1,
  "type": "workout_started",
  "occurred_at_utc": "2026-10-23T11:00:00Z",
  "recorded_at_utc": "2026-10-23T11:00:01Z",
  "time_zone": "Asia/Kolkata",
  "payload": {
    "activity_type": "strength_training"
  }
}
